congress,chamber,rollnumber,date,session,clerk_rollnumber,yea_count,nay_count,nominate_mid_1,nominate_mid_2,nominate_spread_1,nominate_spread_2,nominate_log_likelihood,bill_number,vote_result,vote_desc,vote_question,dtl_desc
100,Senate,348,1987-10-23,,,43,58,0.097,-0.995,-0.359,-0.052,-17.271,,,,,"TO CONFIRM THE NOMINATION OF ROBERT H. BORK, OF THE DISTRICT OF COLUMBIA, TO BE AN ASSOCIATE JUSTICE OF THE SUPREME COURT."
100,Senate,349,1987-10-27,,,93,0,0.0,0.0,0.0,0.0,0.0,,,,,"TO PASS HR 2906, THE FISCAL 1988 MILITARY CONSTRUCTION APPROPRIATIONS, A BILL TO ALLOCATE APPROXIMATELY $8.5 BILLION IN FUNDS FOR THE CONSTRUCTION OF MILITARY FACILITIES."
100,Senate,350,1987-10-27,,,89,9,0.143,0.968,0.158,0.411,-19.185,,,,,"TO AMEND S 1127, THE CATASTROPHIC HEALTH INSURANCE ACT, TO ADD PRESCRIPTION DRUG BENEFITS AND TO RAISE THE OUT OF POCKET COST CEILING."
100,Senate,351,1987-10-27,,,18,77,0.355,-0.116,-0.745,0.015,-13.253,,,,,"TO AMEND S 1127, THE CATASTROPHIC HEALTH INSURANCE ACT, TO PROVIDE CATASTROPHIC BENEFITS ON A VOLUNTARY BASIS."
100,Senate,352,1987-10-27,,,65,32,0.276,-0.745,0.249,0.205,-25.024,,,,,"TO TABLE THE HELMS, NC AMENDMENT TO S 1127, THE CATASTROPHIC HEALTH INSURANCE ACT, WHICH WOULD EXPRESS THE SENSE OF THE SENATE THAT FEDERAL TAX RATES SHOULD NOT BE RAISED."
100,Senate,353,1987-10-27,,,87,11,0.379,0.393,0.176,0.271,-21.031,,,,,"Y=86 N=11 TO PASS HR 2470, THE CATASTROPHIC HEALTH INSURANCE ACT, A BILL TO INCREASE MEDICARE COVERAGE TO INCLUDE PROTECTION AGAINST MEDICAL EXPENSES FOR CATASTROPHIC ILLNESS. PREVIOUSLY, THE SENATE REPLACED THE LANGUAGE OF S 1127 FOR THAT IN HR 2470."
100,Senate,354,1987-10-28,,,92,5,0.253,0.968,0.087,0.427,-17.149,,,,,"TO ADOPT S RES 242, THE CONGRESSIONAL BUDGET AND IMPOUNDMENT CONTROL ACT WAIVER, A RESOLUTION TO WAIVE BUDGET CONSIDERATION RESTRICTIONS WITH REGARDS TO S 1184, THE AIRPORT AND AIRWAY IMPROVEMENT ACT. S 1184 WOULD EXTEND ALLOCATIONS THROUGH FISCAL 1990 FOR AIRPORT AND AIRWAY IMPROVEMENTS."
100,Senate,355,1987-10-28,,,58,37,-0.468,-0.884,0.097,-0.409,-39.442,,,,,"TO TABLE THE KASSEBAUM, KS AMENDMENT TO S 1184, THE AIRPORT AND AIRWAY IMPROVEMENT ACT, WHICH WOULD EXTEND A TRANSPORTATION DEPARTMENT PROGRAM ENSURING AIRLINE SERVICE TO SMALL COMMUNITIES THROUGH SEPTEMBER 30, 1990."
100,Senate,356,1987-10-28,,,97,1,0.0,0.0,0.0,0.0,0.0,,,,,"TO PASS HR 2310, THE AIRPORT AND AIRWAY IMPROVEMENT ACT, A BILL TO REALLOCATE APPROXIMATELY $15.6 BILLION IN FEDERAL FUNDS FOR AIRPORT AND AIRWAY IMPROVEMENTS.  PREVIOUSLY, THE SENATE HAD REPLACED THE LANGUAGE OF S 1184 FOR THAT IN HR 2310."
100,Senate,357,1987-10-29,,,80,16,0.328,-0.693,0.136,-0.27,-27.92,,,,,TO INSTRUCT THE SERGEANT-AT-ARMS TO REQUEST THE ATTENDANCE OF ABSENT SENATORS.
100,Senate,358,1987-10-29,,,85,11,0.607,-0.795,0.249,0.224,-21.01,,,,,"TO PASS HR 2890, THE FISCAL 1988 TRANSPORTATION APPROPRIATIONS, A BILL TO ALLOCATE APPROXIMATELY $11.1 BILLION IN FEDERAL FUNDS TO THE TRANSPORTATION DEPARTMENT AND RELATED AGENCIES."
100,Senate,359,1987-10-29,,,7,83,0.976,0.219,-0.179,0.169,-20.909,,,,,"TO TABLE THE DANFORTH R,MO AMENDMENT TO S 1485, THE AIRLINE PASSENGER PROTECTION RESOLUTION, WHICH WOULD MANDATE PRE-EMPLOYMENT, RANDOM, PERIODIC, AND POST-ACCIDENT DRUG AND ALCOHOL TESTING FOR TRANSPORTATION INDUSTRY PERSONNEL IN ALL ""SAFETY-SENSITIVE"" POSTS."
100,Senate,360,1987-10-30,,,64,29,0.179,0.04,0.28,0.151,-19.754,,,,,"TO AMEND IN THE NATURE OF A SUBSTITUTE S 1485, THE AIRLINE PASSENGER PROTECTION RESOLUTION, TO TRANSFER THE DECISION-MAKING POWER OVER AIRLINE MERGERS FROM THE TRANSPORTATION DEPARTMENT TO THE JUSTICE DEPARTMENT, AND TO REQUIRE THE MERGED AIRLINES TO PAY BENEFITS TO ADVERSELY AFFECTED EMPLOYEES, UNLESS THOSE PAYMENTS EXCEED THE FINANCIAL BENEFITS OF THE MERGER."
100,Senate,361,1987-10-30,,,89,5,0.383,0.924,0.254,0.29,-10.158,,,,,"TO PASS HR 3051, THE AIRLINE PASSENGER PROTECTION RESOLUTION, A BILL TO ESTABLISH MINIMUM PERFORMANCE CRITERIA FOR COMMERCIAL AIRLINES AND REQUIRE MONTHLY REPORTS ON THAT PERFORMANCE. PREVIOUSLY, THE SENATE HAD SUBSTITUTED THE LANGUAGE OF S 1485 FOR THAT IN HR 3051."
100,Senate,362,1987-10-30,,,65,28,0.086,0.996,0.219,0.121,-28.761,,,,,"TO TABLE THE ARMSTRONG, CO AMENDMENT TO SJ RES 209, THE HOUSING PROGRAMS EXTENSION, WHICH WOULD PERMANENTLY EXTEND THE FEDERAL HOUSING ADMINISTRATION MORTGAGE INSURANCE PROGRAMS."
100,Senate,363,1987-11-03,,,23,72,0.022,0.72,-0.342,-0.587,-21.109,,,,,"TO AMEND S 1293, THE INDEPENDENT COUNSEL LAW, TO EXTEND THE APPOINTMENT OF SPECIAL PROSECUTORS TO INVESTIGATE ALLEGED WRONGDOING BY TOP EXECUTIVE-BRANCH OFFICIALS FOR TWO YEARS."
100,Senate,364,1987-11-03,,,50,47,0.128,-0.673,0.152,0.173,-42.51,,,,,"TO TABLE THE ARMSTRONG R,CO AMENDMENT TO S 1293, THE INDEPENDENT COUNSEL LAW, WHICH WOULD EXPAND THE INDEPENDENT COUNSEL LAW TO AUTHORIZE INVESTIGATIONS OF WRONGDOING BY MEMBERS OF CONGRESS."
100,Senate,365,1987-11-03,,,86,11,0.472,0.129,0.254,0.062,-16.406,,,,,"TO PASS HR 2939, THE INDEPENDENT COUNSEL LAW, A BILL TO EXTEND THE APPOINTMENT OF INDEPENDENT PROSECUTORS TO INVESTIGATE WRONGDOING BY TOP EXECUTIVE BRANCH OFFICIALS FOR FIVE YEARS. THE SENATE PREVIOUSLY SUBSTITUTED THE LANGUAGE OF S 1293 FOR THAT IN HR 2939."
100,Senate,366,1987-11-04,,,96,0,0.0,0.0,0.0,0.0,0.0,,,,,"TO CONCUR WITH HOUSE AMENDMENTS TO S 442, THE SEMICONDUCTOR CHIP PROTECTION, A BILL TO PROVIDE SIMILAR COPYRIGHT PROTECTION TO FOREIGN-MADE SEMICONDUCTORS FROM THOSE COUNTRIES HONORING U.S. COPYRIGHTS."
100,Senate,367,1987-11-04,,,55,30,-0.251,0.31,-0.092,0.049,-45.226,,,,,"TO TABLE THE ADAMS, WA AMENDMENT TO HR 2700, THE FISCAL 1988 ENERGY AND WATER APPROPRIATIONS, WHICH WOULD HAVE REMOVED A COMMITTEE AMENDMENT CONCERNING THE PROPOSED PERMANENT NUCLEAR WASTE DISPOSAL SITE."
100,Senate,368,1987-11-05,,,95,0,0.0,0.0,0.0,0.0,0.0,,,,,"TO RATIFY TREATY DOC. 100-3, ANNEX V OF THE INTERNATIONAL CONVENTION FOR THE PREVENTION OF POLLUTION FROM SHIPS MARPOL, A TREATY TO BAN THE DUMPING OF PLASTICS AT SEA."
100,Senate,369,1987-11-05,,,91,4,0.353,0.912,0.243,0.457,-7.563,,,,,"TO TABLE THE HELMS, NC AMENDMENT TO HC RES 195, THE IRAN-CONTRA REPORT, WHICH WOULD EXPRESS THE SENSE OF THE SENATE OPPOSING THE PROSECUTION OF IRAN-CONTRA WITNESSES UNLESS THEIR ACTIVITIES RESULTED IN ILLEGAL FINANCIAL GAIN OR PERJURY."
100,Senate,370,1987-11-05,,,93,0,0.0,0.0,0.0,0.0,0.0,,,,,"TO PASS S 1539, THE RAILROAD SAFETY BILL, A BILL TO ALLOCATE $40.6 MILLION IN FISCAL 1988 AND $41.9 MILLION IN FISCAL 1989 FOR FEDERAL RAILROAD SAFETY PROGRAMS."
100,Senate,371,1987-11-06,,,90,0,0.0,0.0,0.0,0.0,0.0,,,,,"TO RATIFY TREATY DOC. 100-5, THE PACIFIC TUNA TREATY, A TREATY TO AUTHORIZE REGULATIONS FOR U.S.-FLAGGED FISHING VESSELS' OPERATION IN THE SOUTH PACIFIC OCEAN."
100,Senate,372,1987-11-10,,,87,0,0.0,0.0,0.0,0.0,0.0,,,,,"TO INVOKE CLOTURE, THEREBY LIMITING DEBATE ON THE JOHNSTON, LA AMENDMENT TO HR 2700, THE ENERGY AND WATER APPROPRIATIONS, WHICH WOULD INCLUDE ALL COMMITTEE AMENDMENTS WITH THE BILL, INCLUDING ONE CONCERNING THE PERMANENT NUCLEAR WASTE DISPOSAL SITE. MOTION ADOPTED, THREE-FIFTHS OF THOSE SENATORS DULY CHOSEN AND SWORN HAVING VOTED IN THE AFFIRMATIVE."
100,Senate,373,1987-11-12,,,95,0,0.0,0.0,0.0,0.0,0.0,,,,,"TO ADOPT THE CONFERENCE REPORT ON HR 1451, THE OLDER AMERICANS ACT, A BILL TO MANDATE A FOUR-YEAR EXTENSION OF THE OLDER AMERICANS ACT OF 1965 WITH A FISCAL 1988 ALLOCATION OF APPROXIMATELY $1.6 BILLION."
100,Senate,374,1987-11-12,,,65,31,-0.289,-0.308,-0.095,-0.051,-51.582,,,,,"TO ADOPT, EN BLOC, APPROPRIATIONS COMMITTEE AMENDMENTS TO HR 2700, THE ENERGY AND WATER APPROPRIATIONS, THAT CONCERN NUCLEAR WASTE DISPOSAL."
100,Senate,375,1987-11-12,,,40,56,-0.345,0.913,0.123,0.12,-53.791,,,,,"TO AMEND HR 2700, THE ENERGY AND WATER APPROPRIATIONS, TO INSTRUCT THE SECRETARY OF ENERGY TO GIVE PRIMARY CONSIDERATION TO PUBLIC SAFETY AND HEALTH CONCERNS IN CHOOSING A PERMANENT NUCLEAR WASTE DISPOSAL SITE."
100,Senate,376,1987-11-13,,,54,41,0.104,-0.995,0.216,0.059,-29.184,,,,,"TO WAIVE THE BUDGET RESTRICTIONS OF THE GRAMM-RUDMAN-HOLLINGS ANTI-DEFICIT LAW WITH RESPECT TO THE CONFERENCE REPORT ON S 825, THE HOUSING AND COMMUNITY DEVELOPMENT BILL.  S 825 WOULD ALLOCATE $15 BILLION FOR HOUSING IN FISCAL 1988 AND, WITH INFLATIONARY ADJUSTMENTS, 1989.  MOTION REJECTED, THREE-FIFTHS OF THOSE SENATORS DULY CHOSEN AND SWORN NOT HAVING VOTED IN THE AFFIRMATIVE."
100,Senate,377,1987-11-13,,,70,14,-0.06,-0.987,-0.134,-0.372,-28.507,,,,,"TO AMEND HR 2700, THE ENERGY AND WATER APPROPRIATIONS, TO PROHIBIT THE DEPARTMENTS OF ENERGY AND JUSTICE FROM PROSECUTING OR ENFORCING ANY JUDGMENT UNDER A MAY 1987 TEMPORARY EMERGENCY COURT OF APPEALS DECISION AGAINST ANY CORPORATE SHAREHOLDER, OFFICER, OR EMPLOYEE EXCEPT FOR THE ACTUAL AMOUNT PERSONALLY RECEIVED, PLUS INTEREST, THROUGH OIL-OVERCHARGING VIOLATIONS."
100,Senate,378,1987-11-17,,,95,0,0.0,0.0,0.0,0.0,0.0,,,,,"TO RATIFY TREATY DOC. 100-1, THE INTERNATIONAL WHEAT AGREEMENT, A TREATY THAT RENEWS U.S. INVOLVEMENT IN BOTH THE WHEAT TRADE CONVENTION, AN ORGANIZATION THAT MONITORS AND PROVIDES INFORMATION ON THE WORLD GRAIN MARKET, AND IN THE FOOD AID CONVENTION, WHICH COLLECTS FOOD AID FOR DEVELOPING COUNTRIES."
100,Senate,379,1987-11-17,,,99,1,0.0,0.0,0.0,0.0,0.0,,,,,"TO RECONSIDER THE VOTE BY WHICH THE SENATE REJECTED THE CRANSTON, CA MOTION TO WAIVE THE BUDGET RESTRICTIONS OF THE GRAMM-RUDMAN-HOLLINGS ANTI-DEFICIT LAW WITH RESPECT TO THE CONFERENCE REPORT FOR S 825, THE HOUSING AND COMMUNITY DEVELOPMENT BILL."
100,Senate,380,1987-11-17,,,57,43,0.109,-0.994,0.233,0.076,-28.46,,,,,"TO WAIVE THE BUDGET RESTRICTIONS OF THE GRAMM-RUDMANHOLLINGS ANTI-DEFICIT LAW WITH RESPECT TO THE CONFERENCE REPORT FOR S 825, THE HOUSING AND COMMUNITY DEVELOPMENT BILL.  MOTION REJECTED, THREE-FIFTHS OF THOSE SENATORS DULY CHOSEN AND SWORN NOT HAVING VOTED IN THE AFFIRMATIVE."
100,Senate,381,1987-11-18,,,70,19,0.234,-0.972,0.162,-0.198,-30.059,,,,,TO INSTRUCT THE SERGEANT-AT-ARMS TO REQUEST THE ATTENDANCE OF ABSENT SENATORS.
100,Senate,382,1987-11-18,,,35,62,-0.269,-0.251,0.086,0.027,-54.367,,,,,"TO RECOMMIT HR 2700, THE ENERGY AND WATER APPROPRIATIONS, TO THE APPROPRIATIONS COMMITTEE WITH INSTRUCTIONS TO REPORT BACK ALL AMENDMENTS AS WELL AS AN AMENDMENT INSTITUTING A DEADLINE FOR THE SELECTION OF A PERMANENT NUCLEAR WASTE DISPOSAL SITE."
100,Senate,383,1987-11-18,,,86,10,0.697,-0.188,0.139,0.032,-29.649,,,,,"TO PASS HR 2700, THE ENERGY AND WATER APPROPRIATIONS, A BILL TO ALLOCATE APPROXIMATELY $15.9 BILLION IN FEDERAL FUNDS DURING FISCAL 1988 FOR ENERGY AND WATER DEVELOPMENT PROGRAMS UNDER THE ENERGY DEPARTMENT, THE ARMY CORPS OF ENGINEERS, THE BUREAU OF LAND RECLAMATION AND OTHER AGENCIES."
100,Senate,384,1987-11-19,,,88,9,0.7,-0.437,0.191,0.231,-22.397,,,,,"TO ADOPT THE CONFERENCE REPORT ON HR 1748, THE FISCAL 1988-89 DEFENSE AUTHORIZATION, A BILL TO ALLOCATE APPROXIMATELY $211.8 TO $218.4 BILLION FOR MILITARY PROGRAMS UNDER THE DEPARTMENTS OF DEFENSE AND ENERGY."
100,Senate,385,1987-11-20,,,95,1,0.0,0.0,0.0,0.0,0.0,,,,,"TO CONFIRM THE NOMINATION OF FRANK C. CARLUCCI, OF VIRGINIA, TO BE SECRETARY OF DEFENSE."
100,Senate,386,1987-11-20,,,87,8,0.507,0.274,0.249,0.08,-13.514,,,,,"TO ADOPT THE CONFERENCE REPORT ON HR 2939, THE INDEPENDENT COUNSEL LAW, A BILL EXTENDING THE LAW APPOINTING SPECIAL PROSECUTORS TO INVESTIGATE ALLEGED WRONGDOING BY LEADING EXECUTIVE BRANCH OFFICIALS."
100,Senate,387,1987-11-30,,,79,0,0.0,0.0,0.0,0.0,0.0,,,,,"TO CONFIRM THE NOMINATION OF JAMES H. BURNLEY IV, OF NORTH CAROLINA, TO BE SECRETARY OF TRANSPORTATION."
100,Senate,388,1987-12-01,,,73,16,0.567,0.513,0.296,-0.391,-22.45,,,,,TO INSTRUCT THE SERGEANT-AT-ARMS TO REQUEST THE ATTENDANCE OF ABSENT SENATORS.
100,Senate,389,1987-12-01,,,98,0,0.0,0.0,0.0,0.0,0.0,,,,,"TO AMEND THE SYMMS, ID AMENDMENT TO S 373, THE ELEMENTARY AND SECONDARY EDUCATION REAUTHORIZATION, TO PROHIBIT ""DIAL-A-PORN"" OPERATIONS.  THE SYMMS AMENDMENT, REQUIRING PARENTAL APPROVAL FOR PARTICIPATION IN BILINGUAL EDUCATION PROGRAMS, WAS SUBSEQUENTLY ADOPTED BY VOICE VOTE."
100,Senate,390,1987-12-01,,,97,1,0.0,0.0,0.0,0.0,0.0,,,,,"TO PASS HR 5, THE ELEMENTARY AND SECONDARY EDUCATION REAUTHORIZATION, A BILL TO PROVIDE FUNDING THROUGH FISCAL 1993 FOR VARIOUS ELEMENTARY, SECONDARY, AND ADULT EDUCATION PROGRAMS.  PREVIOUSLY, THE SENATE HAD SUBSTITUTED THE LANGUAGE OF S 373 FOR THAT IN HR 5."
100,Senate,391,1987-12-02,,,76,21,0.394,-0.057,0.164,-0.138,-31.735,,,,,TO INSTRUCT THE SERGEANT-AT-ARMS TO REQUEST THE ATTENDANCE OF ABSENT SENATORS.
100,Senate,392,1987-12-02,,,59,37,0.142,-0.744,0.246,0.019,-22.696,,,,,"TO TABLE THE ARMSTRONG, CO AMENDMENT TO HJ RES 404, THE FHA PROGRAMS TEMPORARY EXTENSION, WHICH WOULD MAKE THE MORTGAGE INSURANCE PROGRAMS OF THE FEDERAL HOUSING ADMINISTRATION PERMANENT."
100,Senate,393,1987-12-02,,,48,42,-0.24,0.453,-0.118,-0.221,-48.354,,,,,"TO DELETE LANGUAGE IN THE INOUYE, HI AMENDMENT TO S 1665, THE FARM CREDIT BILL, WHICH WOULD AUTHORIZE STATE, COUNTY, OR MUNICIPAL GOVERNMENTS TO COLLECT TAXES ON LAND HELD IN TRUST FOR AN INDIAN OR INDIAN TRIBE BY THE U.S."
100,Senate,394,1987-12-03,,,75,19,0.192,-0.981,0.15,-0.231,-31.513,,,,,TO INSTRUCT THE SERGEANT-AT-ARMS TO REQUEST THE ATTENDANCE OF ABSENT SENATORS.
100,Senate,395,1987-12-03,,,29,68,0.089,-0.766,0.1,0.342,-46.571,,,,,"TO TABLE THE DECONCINI, AZ AMENDMENT TO S 9, THE OMNIBUS VETERANS' BENEFITS BILL, WHICH WOULD DELETE PROVISIONS FROM THE BILL EXEMPTING THE VETERANS ADMINISTRATION FROM RANDOM DRUG TESTING PROGRAMS FOR FEDERAL EMPLOYEES."
100,Senate,396,1987-12-03,,,24,68,-0.049,-0.694,0.181,0.431,-31.698,,,,,"TO TABLE THE HELMS, NC AMENDMENT TO S 9, THE OMNIBUS VETERANS' BENEFITS BILL, WHICH WOULD ESTABLISH AIDS TESTING AND COUNSELING PROGRAMS FOR VA HOSPITAL PATIENTS AVAILABLE UPON CONSENT."
100,Senate,397,1987-12-04,,,88,6,0.533,-0.846,0.171,-0.147,-18.452,,,,,"TO PASS HR 3030, THE FARM CREDIT ACT, A BILL TO PROVIDE CREDIT ASSISTANCE TO FARMERS THROUGH FEDERAL LOAN GUARANTEES, ADDITIONAL FUNDS, INTEREST SUBSIDIES, AND INCREASED REGULATION OF FARMERS' INTERESTS AND RIGHTS WITHIN THE FARM CREDIT SYSTEM AND THE FARMERS' HOME ADMINISTRATION. PREVIOUSLY, THE SENATE HAD SUBSTITUTED THE LANGUAGE OF S 1665 FOR THAT IN HR 3030."
100,Senate,398,1987-12-04,,,91,0,0.0,0.0,0.0,0.0,0.0,,,,,"TO ADOPT S RES 336, THE HAITI ELECTIONS RESOLUTION, A RESOLUTION TO CONDEMN THE INTERIM GOVERNMENT OF HAITI FOR THE COLLAPSE OF THE NATIONAL ELECTIONS ON NOVEMBER 29, TO EXPRESS SUPPORT FOR DEMOCRACY THERE, AND TO SUSPEND ALL NON-HUMANITARIAN AID TO HAITI."
100,Senate,399,1987-12-04,,,48,44,-0.045,0.0,-0.163,-0.227,-37.45,,,,,"TO TABLE THE THURMOND, SC AMENDMENT TO S 9, THE OMNIBUS VETERANS' BENEFITS BILL, WHICH WOULD PROHIBIT THE MANUFACTURE, SALE, AND POSSESSION OF PLASTIC HANDGUNS."
100,Senate,400,1987-12-04,,,91,0,0.0,0.0,0.0,0.0,0.0,,,,,"TO PASS HR 2616, THE OMNIBUS VETERANS' BENEFITS, A BILL TO INCREASE VETERANS' DISABILITY COMPENSATION AND BENEFITS, AND TO EXPAND HEALTH AND EDUCATION PROGRAMS UNDER THE VETERANS ADMINISTRATION.  PREVIOUSLY, THE SENATE HAD SUBSTITUTED THE LANGUAGE OF S 9 FOR THAT IN HR 2616."
100,Senate,401,1987-12-10,,,82,13,0.48,-0.072,0.176,0.081,-24.177,,,,,"TO WAIVE THE CONGRESSIONAL BUDGET ACT WITH RESPECT TO S 1920, THE FISCAL 1988 BUDGET RECONCILIATION, TO ALLOW FOR CONSIDERATION OF THE BYRD, WV, KASSEBAUM, KS, AND GRAMM, TX ""LEADERSHIP"" AMENDMENTS, WHICH CONSIST OF BIPARTISAN COMPROMISES ON THE FISCAL 1988 BUDGET AS AGREED TO IN THE NOVEMBER 20 BUDGET SUMMIT."
100,Senate,402,1987-12-10,,,48,49,-0.479,0.227,0.029,0.256,-60.339,,,,,"TO WAIVE THE CONGRESSIONAL BUDGET ACT WITH RESPECT TO THE HARKIN, IA AMENDMENT TO THE BYRD, WV AMENDMENT TO S 1920, THE FISCAL 1988 BUDGET RECONCILIATION, WHICH WOULD STRENGTHEN AN EXISTING PER-PERSON CEILING ON FARM PROGRAM PAYMENTS."
100,Senate,403,1987-12-10,,,53,41,-0.519,-0.308,0.004,-0.222,-59.253,,,,,"TO TABLE THE EXON, NE AMENDMENT TO THE BYRD, WV AMENDMENT TO S 1920, THE FISCAL 1988 BUDGET RECONCILIATION, WHICH WOULD ALLOW TAX PAYMENT DEFERRALS FOR FARMS GROSSING OVER $25 MILLION AS LONG AS THE FARM REMAINED AT LEAST 50 PERCENT FAMILY-OWNED."
100,Senate,404,1987-12-10,,,72,24,0.299,-0.139,0.2,0.068,-25.5,,,,,"TO TABLE THE GRAMM, TX AMENDMENT TO THE BYRD, WV AMENDMENT TO S 1920, THE FISCAL 1988 BUDGET RECONCILIATION, WHICH WOULD FREEZE ALL BUDGET AUTHORITY AT 1987 LEVELS, AND THEN SELECTIVELY RAISE CERTAIN 1988 APPROPRIATIONS TO LEVELS AGREED TO AT THE NOVEMBER 20 BUDGET SUMMIT."
100,Senate,405,1987-12-10,,,71,25,-0.746,-0.653,-0.06,-0.028,-56.242,,,,,"TO TABLE THE KASSEBAUM, KS AMENDMENT TO THE BYRD, WV AMENDMENT TO S 1920, THE FISCAL 1988 BUDGET RECONCILIATION, WHICH WOULD FREEZE MOST FEDERAL SPENDING AT 1987 LEVELS, CURTAIL SOCIAL SECURITY INCREASES, AND DELAY FEDERAL TAX RATE REDUCTIONS FOR FISCAL 1988."
100,Senate,406,1987-12-10,,,23,72,0.687,0.726,-0.094,0.056,-51.451,,,,,"TO WAIVE THE CONGRESSIONAL BUDGET ACT WITH RESPECT TO THE PRESSLER, SD AMENDMENT TO THE BYRD, WV AMENDMENT TO S 1920, THE FISCAL 1988 BUDGET RECONCILIATION, WHICH WOULD PERMIT STATE AGENCIES TO REQUEST FEDERAL FUNDS TO COVER FEDERAL STUDENT LOAN DEFAULTS WITHOUT USING MORE STATE FUNDS."
100,Senate,407,1987-12-10,,,66,28,-0.235,-0.964,-0.12,-0.056,-46.427,,,,,"TO AMEND S 1920, THE FISCAL 1988 BUDGET RECONCILIATION, TO STRIKE PROVISIONS ESTABLISHING FEES FOR NEW BROADCAST LICENSES AND PENALTIES FOR BROADCASTERS WHO DO NOT ADHERE TO THE ""FAIRNESS DOCTRINE"", WITH BOTH REVENUES FUNDING PUBLIC BROADCASTING."
100,Senate,408,1987-12-11,,,96,0,0.0,0.0,0.0,0.0,0.0,,,,,"TO CONFIRM THE NOMINATION OF ANN DORE MCLAUGHLIN, OF THE DISTRICT OF COLUMBIA, TO BE SECRETARY OF LABOR."
100,Senate,409,1987-12-11,,,93,0,0.0,0.0,0.0,0.0,0.0,,,,,"TO AMEND HJ RES 395, THE FISCAL 1988 CONTINUING APPROPRIATIONS, TO CHANGE THE EFFECTIVE DATE OF THE JOINT RESOLUTION TO DECEMBER 16, 1987, WHEN TEMPORARY FUNDING CEASES."
100,Senate,410,1987-12-11,,,70,29,0.421,-0.806,0.364,0.583,-22.78,,,,,"TO TABLE THE GRAMM, TX AMENDMENT TO HJ RES 395, THE FISCAL 1988 CONTINUING APPROPRIATIONS, WHICH WOULD LIMIT FUNDING FOR THE LEGAL SERVICES CORPORATION BY REQUIRING THAT 97 PERCENT OF ALL ALLOCATIONS BE SPENT ON LEGAL SERVICES FOR THE POOR."
100,Senate,411,1987-12-11,,,45,51,-0.008,-0.561,-0.191,0.036,-28.263,,,,,"TO AMEND HJ RES 395, THE FISCAL 1988 CONTINUING APPROPRIATIONS, TO SEPARATE OMNIBUS CONTINUING APPROPRIATIONS FOR FISCAL 1988 AND 1989 BEFORE PRESENTING THEM TO THE PRESIDENT."
100,Senate,412,1987-12-11,,,39,56,-0.317,0.82,0.28,0.318,-30.356,,,,,"TO AMEND THE STEVENS, AK AMENDMENT TO HJ RES 395, THE FISCAL 1988 CONTINUING APPROPRIATIONS, TO WITHHOLD ALL HUMANITARIAN AID TO THE NICARAGUAN CONTRAS UNLESS THE REBELS PARTICIPATE IN A CEASE-FIRE OR SUCH AID IS DEEMED CONSISTENT WITH THE ARIAS PEACE PLAN BY A MAJORITY OF THE FIVE TREATY SIGNATORIES."
100,Senate,413,1987-12-11,,,61,33,-0.275,0.541,-0.562,-0.392,-16.182,,,,,"TO TABLE THE HARKIN, IA AMENDMENT TO HJ RES 395, THE FISCAL 1988 CONTINUING APPROPRIATIONS, WHICH WOULD REPEAL PROVISIONS IN THE INTERNATIONAL SECURITY AND DEVELOPMENT COOPERATION ACT THAT EXPEDITE PROCEDURES WITH RESPECT TO AID REQUESTS FOR THE NICARAGUAN CONTRAS."
100,Senate,414,1987-12-11,,,72,22,0.423,-0.117,0.116,0.065,-39.378,,,,,"TO PASS HJ RES 395, THE FISCAL 1988 CONTINUING APPROPRIATIONS, A RESOLUTION TO ALLOCATE APPROXIMATELY $606 BILLION IN FEDERAL FUNDS DURING FISCAL 1988 FOR PROGRAMS UNDER 13 APPROPRIATIONS BILLS."
100,Senate,415,1987-12-19,,,87,2,0.0,0.0,0.0,0.0,0.0,,,,,"TO ADOPT THE CONFERENCE REPORT FOR HR 3030, THE FARM CREDIT ACT, A BILL TO CREATE UP TO $4 BILLION IN GUARANTEED BONDS TO STRENGTHEN THE FARM CREDIT SYSTEM'S RESERVES, TO RESTRUCTURE THE FARM LOAN SYSTEM THROUGH LAND BANK AND REGIONAL DISTRICT MERGERS, TO CREATE A SECONDARY MARKET FOR FARM LOANS, AND TO EXPAND AND REGULATE BORROWERS' RIGHTS FOR FARM CREDIT SYSTEM AND FARMERS HOME ADMINISTRATION BORROWERS."
100,Senate,416,1987-12-19,,,53,35,0.366,0.681,0.161,-0.214,-31.416,,,,,"TO ADOPT S RES 304, THE AGRICULTURE COMMITTEE FUNDING APPROPRIATION, A RESOLUTION TO INCREASE ALLOCATIONS TO THE AGRICULTURE, NUTRITION, AND FORESTRY COMMITTEE FOR FISCAL 1988."
100,Senate,417,1987-12-19,,,64,22,0.404,-0.516,0.147,0.118,-34.07,,,,,"TO ADOPT EN BLOC S RES 306, S RES 311, S RES 319, S RES 321, S RES 322, AND S RES 325, THE COMMITTEE FUNDING RESOLUTIONS, SIX RESOLUTIONS TO AUTHORIZE SUPPLEMENTAL FUNDING FOR THE ARMED SERVICES, FINANCE, VETERANS' AFFAIRS, INDIAN AFFAIRS, APPROPRIATIONS, AND RULES AND ADMINISTRATION COMMITTEES."
100,Senate,418,1987-12-19,,,83,5,-0.558,-0.162,-0.26,0.16,-14.694,,,,,"TO CONFIRM THE NOMINATION OF MARVIN T. RUNYON, OF TENNESSEE, TO BE A MEMBER OF THE BOARD OF DIRECTORS OF THE TENNESSEE VALLEY AUTHORITY."
100,Senate,419,1987-12-21,,,62,29,0.117,0.28,0.148,0.198,-35.469,,,,,"TO ADOPT THE CONFERENCE REPORT ON HR 3545, THE FISCAL 1988 BUDGET RECONCILIATION, A BILL TO REACH DEFICIT-REDUCTION GOALS SET AT THE NOVEMBER 20 BUDGET MEETING BETWEEN THE WHITE HOUSE AND CONGRESSIONAL LEADERS AMOUNTING TO $17.6 BILLION IN FISCAL 1988 AND $22 BILLION IN 1989."
100,Senate,420,1987-12-21,,,61,31,0.341,-0.277,0.08,0.059,-51.266,,,,,"TO ADOPT THE CONFERENCE REPORT ON HJ RES 395, THE FISCAL 1988 CONTINUING APPROPRIATIONS, A JOINT RESOLUTION TO ALLOCATE APPROXIMATELY $603.9 BILLION IN TOTAL BUDGET AUTHORITY FOR ALL FEDERAL PROGRAMS THAT HAD NOT RECEIVED FUNDING FROM CONGRESS FOR FISCAL 1988."
100,Senate,421,1988-01-25,,,73,5,0.755,0.331,0.472,-0.933,-10.198,,,,,TO INSTRUCT THE SERGEANT-AT-ARMS TO REQUEST THE ATTENDANCE OF ABSENT SENATORS.
100,Senate,422,1988-01-27,,,76,16,0.587,0.789,0.259,-0.241,-27.014,,,,,TO INSTRUCT THE SERGEANT-AT-ARMS TO REQUEST THE ATTENDANCE OF ABSENT SENATORS.
100,Senate,423,1988-01-27,,,61,32,0.105,0.205,0.273,0.158,-20.531,,,,,"TO TABLE THE SYMMS, ID AMENDMENT TO S 557, CIVIL RIGHTS RESTORATION ACT, TO RESCIND A PROVISION PERMITTING TEMPORARY OWNERSHIP OF NEWSPAPERS AND TELEVISION STATIONS IN THE SAME CITY."
100,Senate,424,1988-01-27,,,38,57,0.097,-0.222,-0.241,-0.363,-27.241,,,,,"TO AMEND S 557, CIVIL RIGHTS RESTORATION ACT, TO RESTRICT COVERAGE OF THE ACT TO ONLY THOSE PARTS OF A RELIGIOUS INSTITUTION RECEIVING FEDERAL FINANCIAL AID."
100,Senate,425,1988-01-27,,,18,71,0.283,0.019,-0.596,-0.557,-9.985,,,,,"TO AMEND S 557, CIVIL RIGHTS RESTORATION ACT, TO RESTRICT COVERAGE TO ONLY THE PARTICULAR SCHOOL RECEIVING FEDERAL FINANCIAL ASSISTANCE, AND NOT THE ENTIRE SCHOOL SYSTEM."
100,Senate,426,1988-01-27,,,75,15,0.628,0.727,0.269,-0.337,-27.649,,,,,TO INSTRUCT THE SERGEANT-AT-ARMS TO REQUEST THE ATTENDANCE OF ABSENT SENATORS.
100,Senate,427,1988-01-28,,,41,57,0.012,0.063,-0.247,-0.45,-28.284,,,,,"TO AMEND S 557, CIVIL RIGHTS RESTORATION ACT, TO EXPAND THE ""RELIGIOUS TENETS"" EXEMPTION TO INCLUDE INSTITUTIONS THAT ARE CLOSELY IDENTIFIED WITH, NOT JUST CONTROLLED BY, SUCH TENETS."
100,Senate,428,1988-01-28,,,56,42,0.127,-0.283,0.191,0.376,-35.3,,,,,"TO AMEND S 557, CIVIL RIGHTS RESTORATION ACT, TO CLARIFY THAT NO PART OF THE LEGISLATION REQUIRES ANY INDIVIDUAL, PROGRAM, OR INSTITUTION TO PAY FOR OR PERFORM AN ABORTION."
100,Senate,429,1988-01-28,,,59,42,-0.035,-0.338,-0.198,-0.385,-35.856,,,,,"TO AMEND S 557, CIVIL RIGHTS RESTORATION ACT, TO PROVIDE THAT THE ACT DOES NOT REQUIRE ANY FEDERALLY-FUNDED INDIVIDUAL, PROGRAM, OR INSTITUTION TO PERFORM OR PAY FOR AN ABORTION."
100,Senate,430,1988-01-28,,,21,76,0.277,0.016,-0.655,-0.669,-12.311,,,,,"TO AMEND S 557, CIVIL RIGHTS RESTORATION ACT, TO ALLOW INSTITUTION-WIDE APPLICATION OF THE ACT IN EDUCATION, BUT TO RETAIN PREVIOUS COVERAGE FOR ALL OTHER ENTITIES."
100,Senate,431,1988-01-28,,,15,80,0.345,0.241,-0.555,-0.295,-10.613,,,,,"TO AMEND S 557, CIVIL RIGHTS RESTORATION ACT, TO INCREASE EXEMPTIONS FOR SMALL BUSINESSES TO THE ACT, WITH REGARDS TO HANDICAPPED ACCESS PROVISIONS."
100,Senate,432,1988-01-28,,,80,16,0.357,-0.024,0.733,0.376,-7.644,,,,,"TO PASS S 557, CIVIL RIGHTS RESTORATION ACT, A BILL TO RESTORE THE BROAD COVERAGE AND CLARIFY FOUR CIVIL RIGHTS LAWS BY PROVIDING THAT IF ONE PART OF AN INSTITUTION IS FEDERALLY FUNDED, THEN THE ENTIRE INSTITUTION MUST NOT DISCRIMINATE."
100,Senate,433,1988-02-01,,,83,2,0.0,0.0,0.0,0.0,0.0,,,,,"TO ADOPT TREATY DOC. 99-20, ILO CONVENTION NO. 144, A TREATY BASED UPON CONSULTATIONS WITH BUSINESS, LABOR, AND GOVERNMENT LEADERS TO PROMOTE THE IMPLEMENTATION OF INTERNATIONAL LABOR STANDARDS."
100,Senate,434,1988-02-01,,,86,0,0.0,0.0,0.0,0.0,0.0,,,,,"TO ADOPT TREATY DOC. 99-21, ILO CONVENTION NO. 147, A TREATY TO ESTABLISH MINIMUM LIVING AND WORKING STANDARDS FOR MERCHANT SHIPS."
100,Senate,435,1988-02-02,,,86,0,0.0,0.0,0.0,0.0,0.0,,,,,"TO PASS S 908, INSPECTOR GENERAL ACT, A BILL TO ESTABLISH INSPECTOR GENERAL OFFICES IN THE TREASURY DEPARTMENT AND OTHER FEDERAL AGENCIES, AND TO REQUIRE THAT OTHER AGENCIES MAINTAIN INTERNAL AUDITING UNITS."
100,Senate,436,1988-02-03,,,100,0,0.0,0.0,0.0,0.0,0.0,,,,,TO CONFIRM THE NOMINATION OF ANTHONY M. KENNEDY OF CALIFORNIA TO BE AN ASSOCIATE JUSTICE OF THE UNITED STATES SUPREME COURT.
100,Senate,437,1988-02-04,,,54,44,-0.111,0.016,-0.684,-0.939,-13.515,,,,,"TO BEGIN CONSIDERATION OF SJ RES 243, CONTRA AID, A RESOLUTION TO PROVIDE $36.25 MILLION IN AID TO THE CONTRAS."
100,Senate,438,1988-02-04,,,51,48,-0.089,0.044,-0.65,-0.969,-14.328,,,,,"TO PASS SJ RES 243, CONTRA AID, A RESOLUTION TO PROVIDE $36.25 MILLION IN AID TO THE CONTRAS."
100,Senate,439,1988-02-23,,,71,18,0.001,-1.0,0.145,-0.433,-25.933,,,,,TO INSTRUCT THE SERGEANT-AT-ARMS TO REQUEST THE ATTENDANCE OF ABSENT SENATORS.
100,Senate,440,1988-02-23,,,57,17,0.245,-0.428,0.197,-0.446,-18.597,,,,,TO INSTRUCT THE SERGEANT-AT-ARMS TO REQUEST THE ATTENDANCE OF ABSENT SENATORS.
100,Senate,441,1988-02-23,,,57,21,-0.009,-1.0,0.133,-0.268,-27.261,,,,,TO INSTRUCT THE SERGEANT-AT-ARMS TO REQUEST THE ATTENDANCE OF ABSENT SENATORS.
100,Senate,442,1988-02-23,,,47,1,0.0,0.0,0.0,0.0,0.0,,,,,TO INSTRUCT THE SERGEANT-AT-ARMS TO REQUEST THE ATTENDANCE OF ABSENT SENATORS.
