congress,chamber,rollnumber,date,session,clerk_rollnumber,yea_count,nay_count,nominate_mid_1,nominate_mid_2,nominate_spread_1,nominate_spread_2,nominate_log_likelihood,bill_number,vote_result,vote_desc,vote_question,dtl_desc
101,Senate,11,1989-02-02,1.0,11.0,95,5,-0.742,0.626,-0.255,-0.256,-17.906,SJRES7,Amendment Agreed to,"Disapproving the recommendations of the President relating to rates of pay of certain officers and employees of the Federal Government, and for other purposes.",On the Amendment,"TO SUBSTITUTE THE PRESSLER AMENDMENT FOR THE SANFORD (D, NC) RESOLUTION TO SJ RES 7, THE FEDERAL PAY RATE RECOMMENDATIONS."
101,Senate,12,1989-02-07,1.0,12.0,94,6,-0.777,0.419,-0.259,-0.47,-20.531,HJRES129,Joint Resolution Passed,"A joint resolution disapproving the increases in executive, legislative, and judicial salaries recommended by the President under section 225 of the Federal Salary Act of 1967.",On the Joint Resolution,"TO PASS HJ RES 129, TO REJECT THE SALARY INCREASES RECOMMENDED BY THE PRESIDENT FOR THE LEGISLATIVE, EXECUTIVE AND JUDICIAL BRANCHES OF THE FEDERAL GOVERNMENT."
101,Senate,13,1989-02-08,1.0,13.0,101,0,0.0,0.0,0.0,0.0,0.0,PN131,Nomination Confirmed,"Clayton Yeutter, of Nebraska, to be Secretary of Agriculture",On the Nomination,TO CONFIRM CLAYRON YEUTTER AS SECRETARY OF AGRICULTURE.
101,Senate,14,1989-02-28,1.0,14.0,50,47,0.098,0.994,0.105,-0.063,-52.057,SRES66,Motion to Table Agreed to,To strike the provision in the Resolution that would abolish the present spending cap on use of the Frank by Senators.,On the Motion to Table,"TO AMEND S RES 66, OMNIBUS COMMITTEE FUNDING RESOLUTION, TO ABOLISH THE SPENDING CAP ON THE FRANKING PRIVILEGE FOR SENATORS."
101,Senate,15,1989-02-28,1.0,15.0,62,36,0.133,-0.991,0.158,-0.029,-39.65,SRES66,Motion to Table Agreed to,To reduce funding.,On the Motion to Table,"TO AMEND S RES 66, OMNIBUS COMMITTEE FUNDING RESOLUTION, TO LOWER THE AMOUNT OF REPEATING FUNDS FOR 1989 AND 1990."
101,Senate,16,1989-03-01,1.0,16.0,99,1,0.0,0.0,0.0,0.0,0.0,PN134,Nomination Confirmed,"Louis W. Sullivan, of Georgia, to be Secretary of Health and Human Services",On the Nomination,TO CONFIRM LOUIS W. SULLIVAN AS SECRETARY OF HEALTH AND HUMAN SERVICES.
101,Senate,17,1989-03-01,1.0,17.0,100,0,0.0,0.0,0.0,0.0,0.0,PN137,Nomination Confirmed,"Admiral James D. Watkins, United States Navy, Retired, of California, to be Secretary of Energy",On the Nomination,TO CONFIRM JAMES D. WATKINS AS SECRETARY OF ENERGY.
101,Senate,18,1989-03-02,1.0,18.0,95,0,0.0,0.0,0.0,0.0,0.0,PN1381,Nomination Confirmed,"Edward J. Derwinski, of Illinois, to be Secretary of Veterans Affairs",On the Nomination,TO CONFIRM EDWARD J. DERWINSKI AS SECRETARY AND ADMINISTRATOR OF VETERANS' AFFAIRS.
101,Senate,19,1989-03-07,1.0,19.0,100,0,0.0,0.0,0.0,0.0,0.0,PN143,Nomination Confirmed,"Thomas R. Pickering, of New Jersey, to be the Representative of the United States of America to the United Nations with the rank and status of Ambassador, and the Representative of the United States of America in the Security Council of the United Nations",On the Nomination,TO CONFIRM THOMAS R. PICKERING AS AMBASSADOR TO THE UNITED NATIONS.
101,Senate,20,1989-03-09,1.0,20.0,48,53,-0.016,0.345,-0.277,0.129,-15.179,PN129,Nomination Rejected,"John Goodwin Tower, of Texas, to be Secretary of Defense",On the Nomination,TO CONFIRM JOHN G. TOWER AS SECRETARY OF DEFENSE. NOMINATION REJECTED.
101,Senate,21,1989-03-09,1.0,21.0,98,2,0.0,0.0,0.0,0.0,0.0,PN141,Nomination Confirmed,"William J. Bennett, of North Carolina, to be Director of National Drug Control Policy",On the Nomination,TO CONFIRM WILLIAM J. BENNETT AS DIRECTOR OF NATIONAL DRUG CONTROL POLICY.
101,Senate,22,1989-03-16,1.0,22.0,1,92,0.0,0.0,0.0,0.0,0.0,,Motion Rejected,,On the Motion,TO ADOPT THE MOTION TO DISMISS ARTICLES I THROUGH XV OF THE ARTICLES OF IMPEACHMENT AGAINST FEDERAL DISTRICT JUDGE ALCEE L. HASTINGS. MOTION REJECTED.
101,Senate,23,1989-03-16,1.0,23.0,0,93,0.0,0.0,0.0,0.0,0.0,,Motion Rejected,,On the Motion,TO ADOPT THE MOTION TO DISMISS ARTICLE XVII OF THE ARTICLES OF IMPEACHMENT AGAINST FEDERAL DISTRICT JUDGE ALCEE L. HASTINGS. MOTION REJECTED.
101,Senate,24,1989-03-16,1.0,24.0,98,0,0.0,0.0,0.0,0.0,0.0,S20,Bill Passed,"A bill to amend title 5, United States Code, to strengthen the protections available to Federal employees against prohibited personnel practices, and for other purposes.",On Passage of the Bill,"TO PASS S 20, WHISTLEBLOWER PROTECTION ACT, TO GIVE GREATER PROTECTION TO FEDERAL EMPLOYEES AGAINST POSSIBLE REPRISALS FOR REPORTING INEFFICIENCIES AND WRONGDOING IN GOVERNMENT."
101,Senate,25,1989-03-16,1.0,25.0,97,0,0.0,0.0,0.0,0.0,0.0,S607,Bill Passed,A bill to prevent the desecration of the United States Flag.,On Passage of the Bill,"TO PASS S 607, SANCTITY OF UNITED STATES FLAG, TO PROHIBIT THE DESECRATION OF THE FLAG."
101,Senate,26,1989-03-17,1.0,26.0,97,0,0.0,0.0,0.0,0.0,0.0,PN216,Nomination Confirmed,"Richard B. Cheney, of Wyoming, to be Secretary of Defense",On the Nomination,TO CONFIRM RICHARD B. CHENEY AS SECRETARY OF DEFENSE.
101,Senate,27,1989-04-05,1.0,27.0,55,44,0.595,0.307,-0.035,0.376,-57.032,S248,Motion to Table Agreed to,To eliminate the reward provisions of the Major Fraud Act Amendments of 1989.,On the Motion to Table,"TO ADOPT THE BUMPERS AMENDMENT TO S 248, MAJOR FRAUD ACT AMENDMENTS OF 1989, TO GET RID OF REWARD PROVISIONS FOR INDIVIDUALS WHO INFORM THE THE GOVERNMENT ABOUT FRAUD COMMITTED BY CONTRACTORS."
101,Senate,28,1989-04-05,1.0,28.0,83,16,0.827,0.563,0.089,0.096,-44.244,S248,Bill Passed,A bill to amend title 18 of the United States Code to provide increased penalties for certain major frauds against the United States.,On Passage of the Bill,"TO PASS S 248, MAJOR FRAUD ACT AMENDMENTS OF 1989."
101,Senate,29,1989-04-11,1.0,29.0,61,40,0.177,-0.984,0.417,0.22,-14.405,S4,Amendment Agreed to,"A perfecting amendment providing for the ""Minimum Wage Restoration Act of 1989"".",On the Amendment,"TO ADOPT THE GRAHAM AMENDMENT OF A PERFECTING NATURE TO S 4, MINIMUM WAGE RESTORATION ACT."
101,Senate,30,1989-04-11,1.0,30.0,42,58,0.064,-0.998,-0.268,0.007,-20.219,S4,Amendment Rejected,To provide a substitute amendment.,On the Amendment,"TO ADOPT IN THE NATURE OF A SUBSTITUTE THE HATCH AMENDMENT TO S 4, MINIMUM WAGE RESTORATION ACT."
101,Senate,31,1989-04-12,1.0,31.0,86,11,-0.362,-0.932,-0.185,-0.151,-28.688,S4,Amendment Agreed to,"To amend title II of the Social Security Act to increase the monthly earnings test limit, to express the sense of the Congress regarding the phase-out and elimination of such test by the year 2000 for individuals who have attained retirement age, and for other purposes.",On the Amendment,"TO AMEND S 4, MINIMUM WAGE RESTORATION ACT, TO AMEND THE SOCIAL SECURITY ACT TO INCREASE THE MONTHLY EARNINGS."
101,Senate,32,1989-04-12,1.0,32.0,98,0,0.0,0.0,0.0,0.0,0.0,S4,Amendment Agreed to,Expressing the sense of the Senate regarding repeal of section 89 of the Internal Revenue Code.,On the Amendment,"TO AMEND S 4, MINIMUM WAGE RESTORATION ACT, TO EXPRESS THE SENSE OF THE SENATE IN REGARDS TO SECTION 89 OF THE INTERNAL REVENUE CODE."
101,Senate,33,1989-04-12,1.0,33.0,97,1,0.0,0.0,0.0,0.0,0.0,S4,Amendment Agreed to,To express the sense of the Senate regarding working poor families.,On the Amendment,"TO AMEND S 4, MINIMUM WAGE RESTORATION ACT, TO EXPRESS THE SENSE OF THE SENATE AS IT RELATES TO THE WORKING POOR."
101,Senate,34,1989-04-12,1.0,34.0,56,42,-0.157,0.047,-0.19,-0.007,-34.666,S4,Motion Rejected,To delay for 1 year the effective date for section 89 of the Internal Revenue Code of 1986.,On the Motion,"TO AMEND S 4, MINIMUM WAGE RESTORATION ACT, TO DELAY SECTION 89 OF THE INTERNAL REVENUE CODE OF 1986."
101,Senate,35,1989-04-12,1.0,35.0,97,2,0.0,0.0,0.0,0.0,0.0,S4,Amendment Agreed to,"Expressing the sense of the Senate that the Finance Committee review PL 100-360, the Medicare Catastrophic Coverage Act of 1988, specifically the financing mechanism.",On the Amendment,"TO AMEND S 4, MINIMUM WAGE RESTORATION ACT, TO EXPRESS THE SENSE OF THE SENATE THAT THE SENATE FINANCE COMMITTEE HOLD HEARINGS ON THE MEDICARE CATASTROPHIC COVERAGE ACT OF 1988."
101,Senate,36,1989-04-12,1.0,36.0,61,38,0.063,0.102,0.245,0.178,-23.263,S4,Motion to Table Agreed to,"To provide that the Davis-Bacon Act shall apply only to a contractor, or subcontractor, whose annual gross volume of sales made or business done is not less than $500,001.",On the Motion to Table,"TO AMEND S 4, MINIMUM WAGE RESTORATION ACT, TO ALLOW THE DAVIS-BACON ACT TO APPLY TO CONTRACTORS OR SUBCONTRACTORS WHO GROSS OVER $500,000 ANNUALLY."
101,Senate,37,1989-04-12,1.0,37.0,66,33,0.254,-0.91,0.208,0.108,-31.775,S4,Motion to Table Agreed to,To amend the Fair Labor Standards Act to permit an employee to take compensatory time off in lieu of compensation for overtime hours.,On the Motion to Table,"TO AMEND S 4, MINIMUM WAGE RESTORATION ACT, TO TABLE THE WALLOP (R, WY) MOTION TO AMEND THE FAIR LABOR STANDARDS ACT TO PERMIT EMPLOYEES TO TAKE COMPENSATORY TIME INSTEAD OF OVERTIME PAY."
101,Senate,38,1989-04-12,1.0,38.0,43,57,0.047,-0.324,-0.35,-0.217,-16.673,S4,Motion to Recommit Rejected,"A bill to amend the Fair Labor Standards Act of 1938 to restore the minimum wage to a fair and equitable rate, and for other purposes.",On the Motion to Recommit,"TO RECOMMIT S 4, MINIMUM WAGE RESTORATION ACT, TO COMMITTEE."
101,Senate,39,1989-04-12,1.0,39.0,63,38,0.233,-0.972,0.505,0.382,-12.257,HR2,Bill Passed,"A bill to amend the Fair Labor Standards Act of 1938 to restore the minimum wage to a fair and equitable rate, and for other purposes.",On Passage of the Bill,"TO PASS HR 2, MINIMUM WAGE RESTORATION ACT."
101,Senate,40,1989-04-13,1.0,40.0,71,28,-0.005,0.63,0.252,0.451,-25.228,S760,Motion to Table Agreed to,"To help facilitate the purposes of the Act by expanding its definition of ""humanitarian assistance"".",On the Motion to Table,"TO TABLE THE ARMSTRONG (R, CO) AMENDMENT TO S 760, CONTRA AID, TO EXPAND THE DEFINITION OF HUMANITARIAN ASSISTANCE TO ALLOW THAT TYPE OF AID TO BE USED IN THE CARRYING OUT OF SANDINISTA DEMOCRATIZATION REFORMS."
101,Senate,41,1989-04-13,1.0,41.0,72,26,0.254,-0.014,0.164,0.238,-31.689,S760,Motion to Table Agreed to,"To provide that not less than $1,000,000 shall be made available only for the promotion of democratic activities in Nicaragua leading to a transition to democracy.",On the Motion to Table,"TO TABLE THE WALLOP (R, WY) AMENDMENT TO S 760, CONTRA AID, TO SUPPLY FUNDS THAT WOULD ASSIST THE DEVELOPMENT AND PROMOTION OF DEMOCRATIC ACTIVITIES IN NICARAGUA."
101,Senate,42,1989-04-13,1.0,42.0,74,25,0.155,0.232,0.244,0.506,-24.445,S760,Motion to Table Agreed to,To provide non-lethal assistance to the Nicaraguan democratic resistance.,On the Motion to Table,"TO TABLE THE HELMS (R, NC) AMENDMENT TO S 760, CONTRA AID, TO ALLOW FOR NON-LETHAL AID TO THE NICARAGUAN CONTRAS."
101,Senate,43,1989-04-13,1.0,43.0,99,0,0.0,0.0,0.0,0.0,0.0,S760,Motion to Table Agreed to,"To assure full implementation of the Bipartisan Accord on Central America of March 24, 1989.",On the Motion to Table,"TO TABLE THE HELMS (R, NC) AMENDMENT TO S 760, CONTRA AID, TO GUARANTEE THAT HR 1750, BIPARTISAN ACCORD ON CENTRAL AMERICA, IS IMPLEMENTED."
101,Senate,44,1989-04-13,1.0,44.0,91,9,0.795,0.606,0.185,-0.145,-27.89,HR1750,Bill Passed,"A bill to implement the Bipartisan Accord on Central America of March 24, 1989.",On Passage of the Bill,"TO PASS HR 1750, BIPARTISAN ACCORD ON CENTRAL AMERICA."
101,Senate,45,1989-04-18,1.0,45.0,98,0,0.0,0.0,0.0,0.0,0.0,S774,Amendment Agreed to,"That it is a sense of the Congress that the 800-bed local correctional treatment facility be completed at the earliest possible date to assist against crime generally and drug-related crime, specifically.",On the Amendment,"TO AMEND S 774, FINANCIAL INSTITUTIONS REFORM, RECOVERY, AND ENFORCEMENT ACT, TO EXPRESS THE SENSE OF THE SENATE THAT THE DRUG TREATMENT AND CORRECTIONAL FACILITY FOR THE DISTRICT OF COLUMBIA BE FINISHED AS SOON AS POSSIBLE."
101,Senate,46,1989-04-18,1.0,46.0,66,32,-0.174,0.985,-0.08,0.078,-57.067,S774,Motion to Table Agreed to,To broaden the membership and qualifications of the members of the Oversight Board of the Resolution Trust Corporation.,On the Motion to Table,"TO TABLE THE KERRY (D, MA) MOTION TO S 774, FINANCIAL INSTITUTIONS REFORM, RECOVERY AND ENFORCEMENT ACT, TO EXPAND THE QUALIFICATIONS AND MEMBERSHIP OF THE RESOLUTION TRUST CORPORATION."
101,Senate,47,1989-04-18,1.0,47.0,48,50,-0.141,-0.278,0.19,-0.244,-24.834,S774,Motion Rejected,"To make the financing provisions on budget, and for other purposes.",On the Motion,"TO AMEND S 774, FINANCIAL INSTITUTIONS REFORM, RECOVERY AND ENFORCEMENT ACT, TO WAIVE TITLES III AND IV OF THE CONGRESSIONAL BUDGET ACT OF 1974. (MOTION REJECTED, THREE-FIFTHS OF THOSE SENATORS DULY CHOSEN AND SWORN NOT HAVING VOTED IN THE AFFIRMATIVE.)"
101,Senate,48,1989-04-18,1.0,48.0,89,11,0.82,0.572,0.131,0.038,-32.027,S774,Motion Agreed to,"An original bill to reform, recapitalize, and consolidate the Federal deposit insurance system, to enhance the regulatory and enforcement powers of Federal financial institutions regulatory agencies, and for other purposes.",On the Motion,"TO AMEND S 774, FINANCIAL INSTITUTIONS REFORM, RECOVERY AND ENFORCEMENT ACT, TO WAIVE SECTIONS III AND IV OF THE CONGRESSIONAL BUDGET ACT OF 1974 PURSUANT TO SECTION 904. (MOTION PASSED, THREE-FIFTHS OF THOSE SENATORS DULY CHOSEN AND SWORN, HAVING VOTED IN THE AFFIRMATIVE.)"
101,Senate,49,1989-04-18,1.0,49.0,62,37,-0.587,0.491,0.023,0.352,-56.305,S774,Motion to Table Agreed to,To provide discretionary authority for the treatment of certain deposits as deposits for insurance purposes.,On the Motion to Table,"TO AMEND S 774, FINANCIAL INSTITUTIONS REFORM, RECOVERY AND ENFORCEMENT ACT, TO ALLOW FOR THE DISCRETION OF TREATING DEPOSITS AS SUCH FOR INSURANCE PURPOSES."
101,Senate,50,1989-04-19,1.0,50.0,61,38,-0.213,0.037,-0.215,0.163,-33.563,S774,Motion to Table Agreed to,To require confirmation of the Chairman of the Office of Savings Associations.,On the Motion to Table,"TO TABLE THE GRAHAM (D, FL) AMENDMENT TO S 774, FINANCIAL INSTITUTIONS REFORM RECOVERY AND ENFORCEMENT ACT, TO REQUIRE THAT THE CHAIRPERSON OF THE OFFICE OF SAVINGS ASSOCIATION BE CONFIRMED."
101,Senate,51,1989-04-19,1.0,51.0,93,8,-0.293,0.956,-0.187,0.328,-22.118,S774,Bill Passed,"An original bill to reform, recapitalize, and consolidate the Federal deposit insurance system, to enhance the regulatory and enforcement powers of Federal financial institutions regulatory agencies, and for other purposes.",On Passage of the Bill,"TO PASS S 774, FINANCIAL INSTITUTIONS REFORM, RECOVERY AND ENFORCEMENT ACT."
101,Senate,52,1989-05-02,1.0,52.0,11,86,0.487,-0.27,-0.194,-0.004,-20.81,S431,Amendment Rejected,To delete funding for the Commission.,On the Amendment,"TO AMEND THE HELMS AMENDMENT TO  S 431 , MARTIN LUTHER KING, JR. FEDERAL HOLIDAY COMMISSION, TO ELIMINATE ALL FUNDING FOR THE COMMISSION."
101,Senate,53,1989-05-02,1.0,53.0,6,92,0.571,0.102,-0.257,0.102,-13.349,S431,Amendment Rejected,To extend the Commission for two years.,On the Amendment,"TO AMEND  S 431 , MARTIN LUTHER KING, JR. FEDERAL HOLIDAY COMMISSION, TO ALLOW A TWO-YEAR AUTHORIZATION FOR THE COMMITTEE INSTEAD OF FIVE YEARS."
101,Senate,54,1989-05-02,1.0,54.0,19,80,0.384,-0.331,-0.224,-0.157,-23.638,S431,Amendment Rejected,"To prohibit the Martin Luther King, Jr., Federal Holiday Commission from engaging in lobbying activities.",On the Amendment,"TO AMEND THE NUNN (D, GA) AMENDMENT TO  S 431 , MARTIN LUTHER KING, JR. FEDERAL HOLIDAY COMMISSION, TO MAKE LOBBYING BY THE COMMISSION PROHIBITED."
101,Senate,55,1989-05-02,1.0,55.0,7,91,0.684,-0.729,-0.371,-0.476,-11.51,S431,Amendment Rejected,"To prohibit the Martin Luther King, Jr., Federal Holiday Commission from engaging in certain educational activities.",On the Amendment,"TO AMEND THE NUNN (D, GA) AMENDMENT TO  S 431 , MARTIN LUTHER KING, JR. FEDERAL HOLIDAY COMMISSION, TO RESTRICT THE COMMISSION FROM BEING INVOLVED IN PARTICULAR EDUCATIONAL ACTIVITIES."
101,Senate,56,1989-05-02,1.0,56.0,96,0,0.0,0.0,0.0,0.0,0.0,S431,Amendment Agreed to,"To restrict certain activities of the Martin Luther King, Jr., Federal Holiday Commission, to require such Commission to be subject to the Federal Advisory Committee Act.",On the Amendment,"TO AMEND  S 431 , MARTIN LUTHER KING, JR. FEDERAL HOLIDAY COMMISSION, TO PROHIBIT CERTAIN ACTIVITIES AND MAKE THE COMMISSION SUBJECT TO THE FEDERAL ADVISORY COMMITTEE ACT."
101,Senate,57,1989-05-02,1.0,57.0,90,7,0.523,0.21,0.323,-0.028,-11.407,HR1385,Bill Passed,"A bill to make permanent the Martin Luther King Jr., Federal Holiday Commission.",On Passage of the Bill,"TO PASS HR 1385, MARTIN LUTHER KING, JR. FEDERAL HOLIDAY COMMISSION."
101,Senate,58,1989-05-03,1.0,58.0,54,44,-0.303,-0.953,0.35,-0.643,-10.218,SCONRES30,Amendment Agreed to,Calling for further deficit reduction.,On the Amendment,"TO AMEND S CON RES 30, CONGRESSIONAL BUDGET RESOLUTION, TO EXPRESS THE SENSE OF THE SENATE BUDGET NEGOTIATORS SHOULD BEGIN THEIR WORK ON REDUCING THE BUDGET DEFICIT BY JULY 1."
101,Senate,59,1989-05-03,1.0,59.0,97,1,0.0,0.0,0.0,0.0,0.0,SCONRES30,Amendment Agreed to,To provide funds to relieve State prison overcrowding and to provide additional funds for the Bureau of Alcohol Tobacco and Firearms.,On the Amendment,"TO AMEND S CON RES 30, CONGRESSIONAL BUDGET RESOLUTION, TO GIVE ADDITIONAL FUNDING TO THE BUREAU OF ALCOHOL, TOBACCO AND FIREARMS AND SHIFT SOME FUNDS OVER TO HELP PROVIDE RELIEF FOR STATE PRISON OVERCROWDING."
101,Senate,60,1989-05-03,1.0,60.0,64,31,-0.285,0.188,-0.12,-0.052,-48.7,SCONRES30,Motion to Table Agreed to,"To provide increased funding for education, training and social services.",On the Motion to Table,"TO TABLE THE SIMON (D, IL) AMENDMENT TO S CON RES 30, CONGRESSIONAL BUDGET RESOLUTION, TO INCREASE FUNDS FOR EDUCATIONAL AND OTHER SOCIAL SERVICES."
101,Senate,61,1989-05-04,1.0,61.0,18,82,0.324,0.742,-0.023,-0.293,-43.191,SCONRES30,Amendment Rejected,"To set forth the Congressional Budget for the United States Government for the fiscal years 1990, 1991, and 1992.",On the Amendment,"TO AMEND S CON RES 30, CONGRESSIONAL BUDGET RESOLUTION, TO HOLD PAYMENTS FOR SOCIAL SECURITY, MEDICARE AND MEDICAID TO 1989 LEVELS."
101,Senate,62,1989-05-04,1.0,62.0,100,0,0.0,0.0,0.0,0.0,0.0,SRES120,Resolution Agreed to,A resolution relating to free and fair elections in Panama.,On the Resolution,"TO ADOPT  S RES 120, ELECTIONS IN PANAMA, TO EXPRESS THE SENSE OF THE SENATE THAT FREE ELECTIONS BE HELD IN PANAMA."
101,Senate,63,1989-05-04,1.0,63.0,19,81,0.604,0.797,-0.013,-0.344,-42.638,SCONRES30,Motion to Recommit Rejected,"An original concurrent resolution setting forth the congressional budget for the United States Government for the fiscal years 1990, 1991, and 1992.",On the Motion to Recommit,"TO RECOMMIT S CON RES 30, CONGRESSIONAL BUDGET RESOLUTION, BACK TO COMMITTEE WITH INSTRUCTIONS."
101,Senate,64,1989-05-04,1.0,64.0,68,31,0.642,-0.766,0.087,0.155,-56.793,HCONRES106,Resolution Agreed to,"A concurrent resolution setting forth the congressional budget for the United States Government for the fiscal years 1990, 1991, and 1992.",On the Resolution,"TO ADOPT H CON RES 106, CONGRESSIONAL BUDGET RESOLUTION."
101,Senate,65,1989-05-10,1.0,65.0,40,58,-0.173,-0.985,0.069,0.013,-60.118,SJRES100,Joint Resolution Defeated,A joint resolution disapproving the certification by the President under section 481(h) of the Foreign Assistance Act of 1961 with respect to the Bahamas.,On the Joint Resolution,"TO ADOPT SJ RES 100, CERTIFICATION WITH RESPECT TO THE BAHAMAS, TO DECERTIFY THE BAHAMAS UNDER THE FOREIGN ASSISTANCE ACT OF 1961."
101,Senate,66,1989-05-16,1.0,66.0,47,53,0.675,0.738,0.075,-0.339,-58.17,SJRES113,Amendment Rejected,"To prohibit the export of technology, defense articles, and defense services to codevelop the FSX aircraft with Japan.",On the Amendment,"TO AMEND SJ 113, FSX CODEVELOPMENT PROJECT, TO STOP EXPORTING HIGH TECH ARTICLES AND DEFENSE RELATED ITEMS OR SERVICES TO JAPAN."
101,Senate,67,1989-05-16,1.0,67.0,72,28,0.603,0.371,0.209,-0.57,-36.314,SJRES113,Amendment Agreed to,Relating to the cooperative arrangement with Japan regarding the FSX weapon system.,On the Amendment,"TO AMEND SJ 113, FSX CODEVELOPMENT PROJECT, TO AUTHORIZE THE EXPORTATION OF TECHNOLOGY AND OTHER ITEMS TO HELP DEVELOP THE FSX."
101,Senate,68,1989-05-17,1.0,68.0,63,38,0.233,-0.972,0.505,0.382,-12.257,HR2,Conference Report Agreed to,"A bill to amend the Fair Labor Standards Act of 1938 to restore the minimum wage to a fair and equitable rate, and for other purposes.",On the Conference Report,"TO ADOPT THE CONFERENCE REPORT TO HR 2, MINIMUM WAGE RESTORATION ACT."
101,Senate,69,1989-05-18,1.0,69.0,63,37,0.708,-0.706,0.081,0.258,-60.278,HCONRES106,Conference Report Agreed to,"A concurrent resolution setting forth the congressional budget for the United States Government for the fiscal years 1990, 1991, and 1992.",On the Conference Report,"TO ADOPT H CON RES 106, CONGRESSIONAL BUDGET CONFERENCE REPORT."
101,Senate,70,1989-05-31,1.0,70.0,90,0,0.0,0.0,0.0,0.0,0.0,HCONRES136,Concurrent Resolution Agreed to,A concurrent resolution expressing the sense of the Congress on the movement for democracy in China.,On the Concurrent Resolution,"TO ADOPT H CON RES 136, SUPPORTING THE MOVEMENT FOR DEMOCRACY IN CHINA."
101,Senate,71,1989-05-31,1.0,71.0,91,0,0.0,0.0,0.0,0.0,0.0,S593,Amendment Agreed to,To encourage the promulgation of guidelines by persons in the television industry regarding sexually explicit material.,On the Amendment,"TO AMEND H CON RES 136, SUPPORTING THE MOVEMENT FOR DEMOCRACY IN CHINA, TO DEVELOP GUIDELINES TO REGULATE THE USE AND DISPLAY OF SEXUALLY EXPLICIT MATERIAL ON TELEVISION."
101,Senate,72,1989-06-01,1.0,72.0,78,18,0.851,0.455,0.147,-0.332,-43.983,HR2072,Motion to Table Agreed to,A bill to provide for additional funding for Federal prison space.,On the Motion to Table,"TO TABLE THE SPECTER (R, PA) AMENDMENT TO HR 2072, DIRE EMERGENCY SUPPLEMENTAL APPROPRIATIONS, TO GIVE ADDITIONAL FUNDS FOR FEDERAL PRISONS."
101,Senate,73,1989-06-01,1.0,73.0,31,63,-0.277,0.189,0.181,0.172,-39.241,HR2072,Motion to Table Failed,To express the sense of the Senate that a democratically elected government be in place in Panama before the Senate gives its advice and consent for the nominee for the position of Administrator of the Panama Canal Commission.,On the Motion to Table,"TO TABLE THE COATS (R, IN) AMENDMENT TO HR 2072, DIRE EMERGENCY SUPPLEMENTAL APPROPRIATIONS, TO EXPRESS THE SENSE OF THE SENATE THAT THE GOVERNMENT HOLD DEMOCRATIC ELECTIONS BEFORE THE SENATE GIVES ITS APPROVAL OF THE NOMINEE FOR ADMINISTRATOR OF THE PANAMA CANAL TREATY."
101,Senate,74,1989-06-01,1.0,74.0,81,15,0.463,0.886,0.086,0.116,-41.333,HR2072,Motion to Table Agreed to,To provide funds for anti-drug programs as authorized in the Omnibus Anti-Drug Abuse Act of 1988.,On the Motion to Table,"TO TABLE THE D'AMATO (R, NY) AMENDMENT TO HR 2072, DIRE EMERGENCY SUPPLEMENTAL APPROPRIATIONS, TO GIVE MORE FUNDS TO THE ANTI-DRUG EFFORTS."
101,Senate,75,1989-06-01,1.0,75.0,94,0,0.0,0.0,0.0,0.0,0.0,HR2072,Amendment Agreed to,To express the sense of the Senate concerning the restoration of Eastern Airlines.,On the Amendment,"TO AMEND HR 2072, DIRE EMERGENCY SUPPLEMENTAL APPROPRIATIONS, TO EXPRESS THE SENSE OF THE SENATE ABOUT EASTERN AIRLINES RESURRECTION."
101,Senate,76,1989-06-01,1.0,76.0,71,20,-0.562,0.15,-0.121,-0.32,-40.992,HR2072,Motion to Table Agreed to,"To amend the Internal Revenue Code of 1986 to increase the tax on cigarettes, distilled spirits, wines, and beer, and to appropriate the resulting revenues to fund the Omnibus Anti-Substance Abuse Act of 1988.",On the Motion to Table,"TO TABLE THE BIDEN (D, DE) MOTION TO HR 2072, DIRE EMERGENCY SUPPLEMENTAL APPROPRIATIONS, TO INCREASE THE TAXES ON LIQUOR AND CIGARETTES."
101,Senate,77,1989-06-01,1.0,77.0,62,29,0.095,0.995,0.075,0.082,-50.916,HR2072,Motion to Table Motion to Recommit Agreed to,"A bill making dire emergency supplemental appropriations and transfers, urgent supplementals and correcting enrollment errors for the fiscal year ending September 30, 1989, and for other purposes.",On the Motion to Table the Motion to Recommit,"TO TABLE THE WILSON (R, CA) MOTION TO RECOMMIT HR 2072, DIRE EMERGENCY SUPPLEMENTAL APPROPRIATIONS, BACK TO COMMITTEE."
101,Senate,78,1989-06-06,1.0,78.0,100,0,0.0,0.0,0.0,0.0,0.0,SRES142,Resolution Agreed to,"A resolution condemning the brutal use of force by the Government of the People's Republic of China against unarmed Chinese students and workers demonstrating for democracy, and for other purposes.",On the Resolution,"TO ADOPT S RES 142, CONDEMNING BRUTALITY IN CHINA, TO EXPRESS THE SENATE'S CONDEMNATION OF THE BRUTALITY USED AGAINST FREEDOM AND RIGHTS DEMONSTRATORS IN CHINA."
101,Senate,79,1989-06-06,1.0,79.0,69,29,0.168,0.103,0.674,0.577,-10.765,HR2072,Motion to Table Agreed to,To strike the provision dealing with South Africa.,On the Motion to Table,"TO TABLE THE HELMS (R, NC) AMENDMENT TO HR 2072, DIRE EMERGENCY SUPPLEMENTAL APPROPRIATIONS, TO MAKE IT ILLEGAL FOR MUNICIPALITIES AND STATES TO HAVE POLICIES CONCERNING SOUTH AFRICA."
101,Senate,80,1989-06-06,1.0,80.0,99,0,0.0,0.0,0.0,0.0,0.0,HR2072,Motion to Table Failed,To repeal section 89 of the Internal Revenue Code of 1986.,On the Motion to Table,"TO TABLE THE KASTEN AMENDMENT TO HR 2072, DIRE EMERGENCY SUPPLEMENTAL APPROPRIATIONS, TO RECALL SECTION 89 OF THE INTERNAL REVENUE CODE."
101,Senate,81,1989-06-06,1.0,81.0,98,0,0.0,0.0,0.0,0.0,0.0,HR2072,Amendment Agreed to,Relating to section 89 of the Internal Revenue Code of 1986.,On the Amendment,"TO AMEND THE KASTEN (R, WI) AMENDMENT TO HR 2072, DIRE EMERGENCY SUPPLEMENTAL APPROPRIATIONS, TO DELAY THE IMPLEMENTATION OF RULES RELATING TO SECTION 89 OF THE TAX CODE."
